{
  "schema_version": "central-inference-module-e2e-evidence/v1",
  "test_id": "TEST-INF-MODULE-E2E-001",
  "requirement_ids": ["MOD-INF-001", "ARCH-005", "CONTRACT-INFERENCE-001", "FUNC-INF-001", "SEC-TEL-INF-001"],
  "level": "MODULE",
  "applicability": "APPLICABLE",
  "result": "PASS",
  "qualification": "QUALIFIED",
  "admission_accepted": true,
  "admission_rejected": true,
  "batch_digest_exact": true,
  "batch_digest_stable": true,
  "canonical_event_writable": true,
  "class_order_correct": true,
  "duplicate_response_idempotent": true,
  "eligible_workers_count": 1,
  "explicit_profile_selected": true,
  "extra_model_rejected": true,
  "fail_closed": true,
  "full_pool_outage_bounded": true,
  "gateway_process": "masi-inference-gateway",
  "implicit_instance_group_rejected": true,
  "inference_calls": 1,
  "late_result_fenced": true,
  "loaded_not_current": true,
  "mtls_verified": true,
  "nan_rejected": true,
  "inf_rejected": true,
  "no_fallback": true,
  "numeric_match_python_reference": true,
  "ood_handled": true,
  "abstain_handled": true,
  "oversize_rejected": true,
  "plaintext_rejected": true,
  "pool_unavailable_returns_stable_error": true,
  "provider_available": "CPUExecutionProvider",
  "provider_partition_drift_rejected": true,
  "readback_identity_exact": true,
  "real_binary": true,
  "real_triton": true,
  "real_ort": true,
  "repository_closure_exact": true,
  "request_identity_stable": true,
  "result_identity_mismatch_fenced": true,
  "result_digest_conflict_fenced": true,
  "retry_identity_stable": true,
  "same_generation_retry_bounded": true,
  "selected_equals_observed": true,
  "shutdown_exit_zero": true,
  "triton_dynamic_batch": true,
  "triton_instance_group_explicit": true,
  "triton_model_control_none": true,
  "unknown_major_rejected": true,
  "wrong_generation_fenced": true,
  "wrong_hardware_fail_closed": true,
  "overall_module_complete": true
}